{
  "$schema": "./project.identity.schema.json",
  "version": 1,
  "project": {
    "name": "Priya Sarees",
    "slug": "priya-sarees",
    "repo": "priyasareesonline-create/Priya-Sarees",
    "branch": "main"
  },
  "site": {
    "canonicalOrigin": "http://localhost:3000",
    "wwwOrigin": "http://localhost:3000",
    "localOrigins": [
      "http://localhost:3000",
      "http://127.0.0.1:3000",
      "https://priya-sarees.vercel.app"
    ]
  },
  "supabase": {
    "projectRef": "eouhtccprtggeftqiplm",
    "url": "https://eouhtccprtggeftqiplm.supabase.co",
    "regionHint": "ap-south-1"
  },
  "cloudflare": {
    "accountEmail": "",
    "accountId": "17ae91583f8b6b109dbdc636bdf1511e",
    "workerName": "priya-sarees",
    "mediaWorkerName": "priya-sarees-media",
    "productionWranglerConfig": "wrangler.workers.new-account.jsonc",
    "mediaWranglerConfig": "workers/r2-media-proxy/wrangler.jsonc",
    "r2": {
      "mediaBucket": "priya-sarees-cdn",
      "nextCacheBucket": "priya-sarees-next-cache",
      "s3Endpoint": "https://17ae91583f8b6b109dbdc636bdf1511e.r2.cloudflarestorage.com"
    }
  },
  "vercel": {
    "teamSlug": "priya-sarees",
    "projectSlug": "priya-sarees",
    "productionHost": "localhost:3000"
  },
  "github": {
    "owner": "priyasareesonline-create",
    "repo": "Priya-Sarees",
    "pushAccount": "priyasareesonline-create"
  },
  "authRedirectOrigins": [
    "http://localhost:3000",
    "http://127.0.0.1:3000",
    "https://priya-sarees.vercel.app"
  ],
  "forbidden": {
    "description": "Never use these for Priya Sarees deploys, R2, env, or wrangler login.",
    "cloudflareAccountEmails": [
      "thrycoproduct@gmail.com",
      "shaarunew01@gmail.com",
      "sripalanitextilesonline@gmail.com"
    ],
    "cloudflareAccountIds": [
      "77dfa9b757691b2321fe0630f01c8c6a",
      "542992b23690c0c07bb23e5fecffa6ec"
    ],
    "supabaseProjectRefs": [
      "azqgyxdzwlhdmjvkngbs",
      "xytdexahcdyhykvuwpys",
      "rzwbpjjayarptlwjfpzm",
      "qhtwwyqlsnckorndmhmt"
    ],
    "siteHosts": [
      "thryco.com",
      "www.thryco.com",
      "media.thryco.com",
      "thry-thryco.vercel.app",
      "thry-self.vercel.app",
      "thry.thrycoproduct.workers.dev",
      "hubsofcraftss.com",
      "www.hubsofcraftss.com",
      "hubofcraftss.com",
      "www.hubofcraftss.com",
      "sairaghavendratex.com",
      "www.sairaghavendratex.com",
      "ssr-tex-shop.vercel.app",
      "hubs-of-craftss-project.vercel.app"
    ],
    "r2Buckets": [
      "thry-cdn",
      "thry-next-cache",
      "hubofcraftss-cdn",
      "hubofcraftss-next-cache"
    ]
  },
  "notes": [
    "Priya Sarees is a NEW shop. Secrets stay in .env.local — never commit them.",
    "Cloudflare account id 17ae91583f8b6b109dbdc636bdf1511e is the only allowed R2/Workers account.",
    "Supabase project eouhtccprtggeftqiplm is the only allowed DB/auth project.",
    "Production custom domain is not set yet — canonical origin is localhost until NEXT_PUBLIC_SITE_URL is provided.",
    "Run npm run validate:identity before auth, R2, wrangler, or deploy work."
  ]
}
